{
  "id": "acl-sinfonion",
  "name": "Sinfonion",
  "maker": "ACL",
  "hp": 42,
  "modulargrid": {
    "url": "https://modulargrid.net/e/acl-sinfonion",
    "listedAs": "ACL Sinfonion"
  },
  "inputs": [
    "CH1 IN",
    "CH1 TRIG",
    "CH1 A/B",
    "CH2 IN",
    "CH2 TRIG",
    "CH3 IN",
    "CH3 TRIG",
    "ROOT CV",
    "TRANS CV",
    "CV 1",
    "CV 2",
    "CV 3",
    "CV 4",
    "ASSIGN IN 1",
    "ASSIGN IN 2",
    "CHORDS IN",
    "CHORDS TRIG",
    "ARP IN",
    "ARP CLK",
    "SEQ CLK"
  ],
  "outputs": [
    "CH1 OUT",
    "CH2 OUT",
    "CH3 OUT",
    "CHORDS OUT 1",
    "CHORDS OUT 2",
    "CHORDS OUT 3",
    "CHORDS OUT 4",
    "ARP OUT",
    "ASSIGN OUT 1",
    "ASSIGN OUT 2",
    "GATE 1",
    "GATE 2"
  ],
  "signals": {
    "CH1 IN": "pitch",
    "CH1 TRIG": "gate",
    "CH1 A/B": "gate",
    "CH2 IN": "pitch",
    "CH2 TRIG": "gate",
    "CH3 IN": "pitch",
    "CH3 TRIG": "gate",
    "ROOT CV": "pitch",
    "TRANS CV": "pitch",
    "CV 1": "cv",
    "CV 2": "cv",
    "CV 3": "cv",
    "CV 4": "cv",
    "ASSIGN IN 1": "cv",
    "ASSIGN IN 2": "cv",
    "CHORDS IN": "pitch",
    "CHORDS TRIG": "gate",
    "ARP IN": "pitch",
    "ARP CLK": "clock",
    "SEQ CLK": "clock",
    "CH1 OUT": "pitch",
    "CH2 OUT": "pitch",
    "CH3 OUT": "pitch",
    "CHORDS OUT 1": "pitch",
    "CHORDS OUT 2": "pitch",
    "CHORDS OUT 3": "pitch",
    "CHORDS OUT 4": "pitch",
    "ARP OUT": "pitch",
    "ASSIGN OUT 1": "cv",
    "ASSIGN OUT 2": "cv",
    "GATE 1": "gate",
    "GATE 2": "gate"
  },
  "confidence": "high",
  "source": "sinfonion-manual-1.0c.pdf p.1 (panel photo, PATCHBAY section) + p.6 Features (32 jacks: 8 pitch out, 4 gate out, 11 CV in, 9 gate in)",
  "notes": "32 jacks total, matching the manual count. Panel labels in ASSIGN section are just 'IN 1/IN 2/OUT 1/OUT 2' and the standalone sequencer clock is just 'CLK' (right of ARP CLK); prefixed for disambiguation. CV 1-4, ASSIGN IN 1/2 (gate) and ASSIGN OUT 1/2 (gate) are menu-assignable. GATE 1/2 are gate outputs driven by the GATES buttons/sequencer. CH1 A/B is a gate input switching Channel 1 sides when 'Channel 1 A/B' is set to 'via jack'. All inputs normalled to 0 V.",
  "contributors": [
    "tripswitch"
  ]
}
