{
  "id": "1010-music-bitbox-2",
  "name": "Bitbox 2.0",
  "maker": "1010 Music",
  "hp": 26,
  "modulargrid": {
    "url": "https://modulargrid.net/e/1010-music-bitbox-2-0",
    "listedAs": "1010 Music Bitbox 2.0"
  },
  "inputs": [
    "MIDI IN",
    "CLOCK",
    "IN1",
    "IN2",
    "TRIG 1",
    "TRIG 2",
    "TRIG 3",
    "TRIG 4 / EXT 5",
    "TRIG 5",
    "TRIG 6",
    "TRIG 7",
    "TRIG 8 / EXT 6",
    "TRIG 9",
    "TRIG 10",
    "TRIG 11",
    "TRIG 12 / EXT 7",
    "TRIG 13",
    "TRIG 14",
    "TRIG 15",
    "TRIG 16 / EXT 8",
    "EXT 1",
    "EXT 2",
    "EXT 3",
    "EXT 4"
  ],
  "outputs": [
    "FX1",
    "FX2",
    "OUT1",
    "OUT2"
  ],
  "signals": {
    "MIDI IN": "any",
    "CLOCK": "clock",
    "IN1": "audio",
    "IN2": "audio",
    "TRIG 1": "gate",
    "TRIG 2": "gate",
    "TRIG 3": "gate",
    "TRIG 4 / EXT 5": "gate",
    "TRIG 5": "gate",
    "TRIG 6": "gate",
    "TRIG 7": "gate",
    "TRIG 8 / EXT 6": "gate",
    "TRIG 9": "gate",
    "TRIG 10": "gate",
    "TRIG 11": "gate",
    "TRIG 12 / EXT 7": "gate",
    "TRIG 13": "gate",
    "TRIG 14": "gate",
    "TRIG 15": "gate",
    "TRIG 16 / EXT 8": "gate",
    "EXT 1": "cv",
    "EXT 2": "cv",
    "EXT 3": "cv",
    "EXT 4": "cv",
    "FX1": "audio",
    "FX2": "audio",
    "OUT1": "audio",
    "OUT2": "audio"
  },
  "confidence": "medium",
  "source": "bitbox-mk2-2.0-user-manual-2023-03-01-clean.pdf p.7 (Front Panel Overview, manual pp.10-11) and p.41 (EXT Ports figure)",
  "notes": "Manual: MIDI in (TRS, type A/B), clock in, 2 audio ins, 20 CV inputs, 4 audio outs. The 5x4 CV grid is unlabelled on the panel: the first four columns trigger the 16 pads (named here TRIG 1-16, row by row from top-left); the 4th column doubles as EXT 5-8 (top to bottom) and the 5th (rightmost) column is EXT 1-4 (top to bottom) for modulation. IN1/IN2 are a stereo record pair and also usable as precise CV (1V/oct). Outputs FX1/FX2/OUT1/OUT2 are configurable as mono or stereo pairs.",
  "contributors": [
    "tripswitch"
  ]
}
